{
  "brand": "AC Infinity",
  "series": "Australian Charcoal Carbon Filter",
  "model": "Duct Carbon Filter 8\"",
  "revision": null,
  "status": "active",
  "filter_role": "primary_exhaust_filter",
  "is_primary_filter_default": true,
  "include_in_default_ventilation_calculator": true,
  "filter_type": "inline_carbon_filter",
  "carbon_type": "Australian Virgin RC412, 1200+ IAV",
  "carbon_weight_kg": null,
  "carbon_bed_thickness_mm": 38.0,
  "housing_material": null,
  "pre_filter_included": true,
  "pre_filter_replaceable": true,
  "reversible": true,
  "refillable": false,
  "flange_diameter_mm": 200.0,
  "duct_size_label": "8 inch",
  "length_mm": 460.0,
  "diameter_mm": 277.0,
  "weight_kg": null,
  "max_airflow_m3_h": 1308.2,
  "recommended_airflow_m3_h": 981.2,
  "min_airflow_m3_h": null,
  "pressure_drop_pa": null,
  "fan_match_note": null,
  "odor_control_rating": null,
  "lifetime_months_min": null,
  "lifetime_months_max": null,
  "humidity_limit_percent": null,
  "temperature_limit_c": null,
  "grow_area_min_cm": null,
  "grow_area_max_cm": null,
  "tent_size_recommendation": null,
  "source_url": "https://acinfinity.com/hydroponics-growers/duct-carbon-filter-australian-charcoal-8-inch/",
  "source_type": "manufacturer",
  "source_date": "2026-06-27",
  "confidence_level": "A",
  "uvp_amount": 119.0,
  "uvp_currency": "USD",
  "uvp_source_url": "https://acinfinity.com/hydroponics-growers/duct-carbon-filter-australian-charcoal-8-inch/",
  "uvp_source_type": "manufacturer",
  "uvp_source_date": "2026-06-27",
  "uvp_confidence_level": "A",
  "uvp_notes": null,
  "notes": "Commonly listed airflow 750 CFM converted to m³/h. Verify exact current product page values before upgrading confidence. Recommended airflow derived as 75% of listed max airflow. | Official AC Infinity specs: 8 inch, 20 in length, 770 CFM, RC412 1200+ IAV, 38mm bed; m³/h converted from CFM."
}