{
  "brand": "Rhino Filters",
  "series": "Pro Series",
  "model": "100mm 255m³",
  "revision": null,
  "status": "active",
  "filter_role": "primary_exhaust_filter",
  "is_primary_filter_default": null,
  "include_in_default_ventilation_calculator": null,
  "filter_type": "inline_carbon_filter",
  "carbon_type": "Australian RC412",
  "carbon_weight_kg": null,
  "carbon_bed_thickness_mm": 50.0,
  "housing_material": null,
  "pre_filter_included": true,
  "pre_filter_replaceable": true,
  "reversible": true,
  "refillable": false,
  "flange_diameter_mm": 100.0,
  "duct_size_label": null,
  "length_mm": null,
  "diameter_mm": null,
  "weight_kg": null,
  "max_airflow_m3_h": 255.0,
  "recommended_airflow_m3_h": 191.25,
  "min_airflow_m3_h": 127.5,
  "pressure_drop_pa": null,
  "fan_match_note": null,
  "odor_control_rating": null,
  "lifetime_months_min": 20.0,
  "lifetime_months_max": 24.0,
  "humidity_limit_percent": 80.0,
  "temperature_limit_c": 50.0,
  "grow_area_min_cm": null,
  "grow_area_max_cm": null,
  "tent_size_recommendation": null,
  "source_url": "https://www.amazon.de/Rhino-Filter-255m%C2%B3-Aktivkohlefilter-Anschlu%C3%9F/dp/B00PEPOT62",
  "source_type": "amazon_de",
  "source_date": "2026-06-27",
  "confidence_level": "A",
  "uvp_amount": null,
  "uvp_currency": null,
  "uvp_source_url": null,
  "uvp_source_type": null,
  "uvp_source_date": null,
  "uvp_confidence_level": null,
  "uvp_notes": null,
  "notes": null
}