{
  "brand": "RAM",
  "series": "Budget Carbon Filter",
  "model": "Budget Carbon Filter 100/200",
  "revision": null,
  "status": "active",
  "filter_role": "primary_exhaust_filter",
  "is_primary_filter_default": true,
  "include_in_default_ventilation_calculator": true,
  "filter_type": "inline_carbon_filter",
  "carbon_type": "activated carbon",
  "carbon_weight_kg": null,
  "carbon_bed_thickness_mm": null,
  "housing_material": "metal",
  "pre_filter_included": true,
  "pre_filter_replaceable": true,
  "reversible": null,
  "refillable": null,
  "flange_diameter_mm": 100.0,
  "duct_size_label": "100 mm",
  "length_mm": null,
  "diameter_mm": null,
  "weight_kg": null,
  "max_airflow_m3_h": 200.0,
  "recommended_airflow_m3_h": 150.0,
  "min_airflow_m3_h": null,
  "pressure_drop_pa": null,
  "fan_match_note": "Match fan nominal airflow at or below filter max airflow; for odor control prefer recommended airflow range.",
  "odor_control_rating": null,
  "lifetime_months_min": null,
  "lifetime_months_max": null,
  "humidity_limit_percent": 70.0,
  "temperature_limit_c": null,
  "grow_area_min_cm": null,
  "grow_area_max_cm": null,
  "tent_size_recommendation": null,
  "source_url": "https://www.lumii.co.uk/",
  "source_type": "retailer_or_catalog_to_verify",
  "source_date": "2026-06-27",
  "confidence_level": "C",
  "uvp_amount": null,
  "uvp_currency": null,
  "uvp_source_url": "https://www.lumii.co.uk/",
  "uvp_source_type": "retailer_or_catalog_to_verify",
  "uvp_source_date": null,
  "uvp_confidence_level": "D",
  "uvp_notes": null,
  "notes": "RAM budget filter family; verify exact SKU and dimensions. Recommended airflow derived as 75% of listed max airflow."
}