{
  "brand": "CarboAir",
  "series": "CarboAir 50/75/100",
  "model": "CarboAir 75 200/1000",
  "revision": null,
  "status": "active",
  "filter_role": "primary_exhaust_filter",
  "is_primary_filter_default": true,
  "include_in_default_ventilation_calculator": true,
  "filter_type": "inline_carbon_filter",
  "carbon_type": "virgin activated carbon",
  "carbon_weight_kg": null,
  "carbon_bed_thickness_mm": null,
  "housing_material": "metal",
  "pre_filter_included": true,
  "pre_filter_replaceable": true,
  "reversible": null,
  "refillable": null,
  "flange_diameter_mm": 200.0,
  "duct_size_label": "200 mm",
  "length_mm": null,
  "diameter_mm": null,
  "weight_kg": null,
  "max_airflow_m3_h": 1000.0,
  "recommended_airflow_m3_h": 750.0,
  "min_airflow_m3_h": null,
  "pressure_drop_pa": null,
  "fan_match_note": "Match fan nominal airflow at or below filter max airflow; for odor control prefer recommended airflow range.",
  "odor_control_rating": null,
  "lifetime_months_min": null,
  "lifetime_months_max": null,
  "humidity_limit_percent": 70.0,
  "temperature_limit_c": null,
  "grow_area_min_cm": null,
  "grow_area_max_cm": null,
  "tent_size_recommendation": null,
  "source_url": "https://www.globalairsupplies.co.uk/carboair/",
  "source_type": "manufacturer_or_catalog_to_verify",
  "source_date": "2026-06-27",
  "confidence_level": "C",
  "uvp_amount": null,
  "uvp_currency": null,
  "uvp_source_url": "https://www.globalairsupplies.co.uk/carboair/",
  "uvp_source_type": "manufacturer_or_catalog_to_verify",
  "uvp_source_date": null,
  "uvp_confidence_level": "D",
  "uvp_notes": null,
  "notes": "CarboAir added as important UK/EU AKF brand; airflow/sizes require catalogue verification. Recommended airflow derived as 75% of listed max airflow."
}