{
  "brand": "Spider Farmer",
  "series": "Carbon Filter",
  "model": "Carbon Filter 4\"",
  "revision": null,
  "status": "active",
  "filter_role": "primary_exhaust_filter",
  "is_primary_filter_default": true,
  "include_in_default_ventilation_calculator": true,
  "filter_type": "inline_carbon_filter",
  "carbon_type": "activated charcoal",
  "carbon_weight_kg": null,
  "carbon_bed_thickness_mm": null,
  "housing_material": null,
  "pre_filter_included": true,
  "pre_filter_replaceable": true,
  "reversible": true,
  "refillable": null,
  "flange_diameter_mm": 100.0,
  "duct_size_label": "4 inch / approx. 100 mm",
  "length_mm": null,
  "diameter_mm": null,
  "weight_kg": null,
  "max_airflow_m3_h": 339.8,
  "recommended_airflow_m3_h": 254.9,
  "min_airflow_m3_h": null,
  "pressure_drop_pa": null,
  "fan_match_note": null,
  "odor_control_rating": null,
  "lifetime_months_min": null,
  "lifetime_months_max": null,
  "humidity_limit_percent": null,
  "temperature_limit_c": null,
  "grow_area_min_cm": null,
  "grow_area_max_cm": null,
  "tent_size_recommendation": null,
  "source_url": "https://spiderfarmer.eu/search?q=4%20carbon%20filter",
  "source_type": "manufacturer_search",
  "source_date": "2026-06-27",
  "confidence_level": "C",
  "uvp_amount": null,
  "uvp_currency": null,
  "uvp_source_url": null,
  "uvp_source_type": null,
  "uvp_source_date": null,
  "uvp_confidence_level": "D",
  "uvp_notes": null,
  "notes": "Airflow class 200 CFM converted to m³/h; exact current EU/DE product data pending. Recommended airflow derived as 75% of listed max airflow."
}