{
  "brand": "CarbonActive",
  "series": "Granulate",
  "model": "Aktivkohlefilter 300 m³/h 125mm Granulate",
  "revision": null,
  "status": "active",
  "filter_role": "primary_exhaust_filter",
  "is_primary_filter_default": true,
  "include_in_default_ventilation_calculator": true,
  "filter_type": "inline_carbon_filter",
  "carbon_type": "coconut activated carbon",
  "carbon_weight_kg": null,
  "carbon_bed_thickness_mm": null,
  "housing_material": null,
  "pre_filter_included": null,
  "pre_filter_replaceable": null,
  "reversible": null,
  "refillable": null,
  "flange_diameter_mm": 125.0,
  "duct_size_label": "125 mm",
  "length_mm": null,
  "diameter_mm": null,
  "weight_kg": null,
  "max_airflow_m3_h": 300.0,
  "recommended_airflow_m3_h": 225.0,
  "min_airflow_m3_h": null,
  "pressure_drop_pa": null,
  "fan_match_note": null,
  "odor_control_rating": null,
  "lifetime_months_min": null,
  "lifetime_months_max": null,
  "humidity_limit_percent": null,
  "temperature_limit_c": null,
  "grow_area_min_cm": null,
  "grow_area_max_cm": null,
  "tent_size_recommendation": null,
  "source_url": "https://carbonactive.com/produkt/aktivkohlefilter/",
  "source_type": "manufacturer",
  "source_date": "2026-06-27",
  "confidence_level": "A",
  "uvp_amount": null,
  "uvp_currency": null,
  "uvp_source_url": "https://carbonactive.com/produkt/aktivkohlefilter/",
  "uvp_source_type": "manufacturer",
  "uvp_source_date": "2026-06-27",
  "uvp_confidence_level": "D",
  "uvp_notes": "Exact variant UVP not resolved.",
  "notes": "Manufacturer configurator lists max airflow options 200/300/400/500/650/800/1000/1200/3500/7000 m³/h, flange options 125/200/315/400 mm and Standard/Granulate. Variant combination should be verified before final import. Recommended airflow derived as 75% of listed max airflow."
}